club_name,description,location,max_members,teacher_id,allow_m1,allow_m2,allow_m3,allow_m4,allow_m5,allow_m6
ชุมนุมคอมพิวเตอร์,เรียนรู้การเขียนโปรแกรมและการใช้คอมพิวเตอร์ขั้นสูง,ห้องคอมพิวเตอร์ 1,20,246,0,0,0,1,1,1
ชุมนุมภาษาอังกฤษ,พัฒนาทักษะการสื่อสารภาษาอังกฤษและเรียนรู้วัฒนธรรมต่างประเทศ,ห้อง 506,35,247,1,1,1,1,1,1
ชุมนุมวิทยาศาสตร์,ทำการทดลองและโครงงานวิทยาศาสตร์,ห้องปฏิบัติการวิทย์ 2,20,248,0,0,1,1,1,0
ชุมนุมดนตรีไทย,เรียนรู้และฝึกปฏิบัติเครื่องดนตรีไทย,ห้องดนตรีไทย,20,249,1,1,1,1,1,1
ชุมนุมดนตรีสากล,เล่นดนตรีและร้องเพลงสมัยนิยม,ห้องดนตรีสากล,20,250,0,0,0,1,1,1
